vision_id,vision_category,vision_position,vision_title,vision_description
1,経営・事業戦略,CEO,CEOとして企業のビジョンと戦略を策定し、企業価値を最大化する,"市場規模や変化への深い理解から、持続可能な成長を実現する。経営戦略を立案し、全社的な意思決定を担い、サービス・人事組織・マーケティングを統合した企業経営を行う。"
2,経営・事業戦略,COO,COOとして事業運営を担い、企業価値の向上を実現する,"CEOと連携して経営戦略を策定し、実行や運営において中核的役割を担う。各部門の戦略遂行をリードし、事業成長の安定化を担う。"
3,経営・事業戦略,M&A・投資プロフェッショナル,投資・M&Aのプロとして、資本の力で事業成長を加速させる,"PEファンドや事業会社において、投資実行、バリュエーション、PMIを主導する。経営権に関与し、企業価値を飛躍的に向上させるダイナミックな役割を担う。"
4,経営・事業戦略,スタートアップ起業家,スタートアップを起業し、新たな顧客価値を形づくる,"市場への深い洞察から、リスクを取って新たな事業を立ち上げる。必要に応じてピボットしながら、顧客に求められるサービスを生み出し、ゼロから事業成長と組織構築を主導する。"
5,経営・事業戦略,経営企画責任者,経営企画として、企業の中長期的な成長戦略の策定を主導する,"経営陣と連携し、戦略策定のための調査やM&A、新規事業検討を行う。部門横断的なプロジェクトを推進し、経営の意思決定を支える参謀となる。"
6,経営・事業戦略,事業責任者,事業の責任者としてPL責任を持ち、事業価値を最大化する,"企業の中核事業をグロースさせる責任者として、事業を統括し、サービスリリース、収益化、事業拡大までを一貫して主導する。"
7,経営・事業戦略,独立コンサルタント,独立プロフェッショナルとして、個人の知見で価値提供する,"組織に属さず、高度な専門性と実績を武器にクライアントの課題を解決する。自身のブランドを確立し、時間と収入と裁量を自らコントロールする。"
8,営業・事業開発,BizDev（事業開発）,事業会社のBizDevとして、様々な手段を駆使しながら事業をリードする,"新規事業の立案にとどまらず、アライアンス構築、プロダクト推進といった幅広い領域をカバー。泥臭く行動し、会社に新しい収益を生み出す。"
9,営業・事業開発,アカウントマネージャー,深耕営業のプロとして、大口顧客との強固なリレーションを築く,"既存の重要顧客に入り込み、潜在的な課題を発掘して解決策を提案する。長期的かつ安定的な取引関係を構築し、LTVを最大化する。"
10,営業・事業開発,カスタマーサクセス,カスタマーサクセスとして、顧客の成功とLTV最大化を担う,"単なる対応業務ではなく、顧客の事業課題に対し能動的に活用提案を行う。顧客の成功を通じて、解約阻止やアップセルを実現し、信頼されるパートナーとなる。"
11,営業・事業開発,トップセールス,トップセールスとして、営業活動における実績と品質の双方をリードする,"継続的にKPI達成率150%以上の高い実績を出し続けながら、いまだバリューチェーンが通っていない領域での成果創出を担う。"
12,営業・事業開発,営業企画・推進,営業企画として、営業組織全体の生産性を最大化する,"優れた営業手法の型化、SFA/CRMツールの導入・運用、インセンティブ設計を行う。データに基づいた科学的なアプローチで、個人の力に依存しない強い組織を作る。"
13,営業・事業開発,営業部長,営業部長として、全社の売上構築をリードする,"全社の中長期的な売上利益最大化を担う。ターゲティングやチャネル設計など営業戦略を描き、営業組織の構築、育成、制度設計など人事領域も手掛けていく。"
14,人事・組織開発,CHRO,CHROとして、事業成長を組織力で牽引する,"採用・育成・評価・報酬・配置・代謝という人事機能を束ね、組織人事戦略の策定から実行までを担い、経営目標の達成に貢献する。"
15,人事・組織開発,HRBP,経営者や事業責任者のビジネスパートナーとして、組織課題を解決する,"事業部と密接に連携し、組織のニーズを理解し、適切な人事施策を提案、実行する。戦略的パートナーとして事業目標達成に貢献する。"
16,人事・組織開発,組織人事コンサルタント,組織人事コンサルタントとして、クライアントの組織変革を支援する,"人事制度設計、人材開発、M&A後の組織統合(PMI)などの課題を解決する。高度な専門知見を用いて経営層と対話し、あるべき組織の姿を実現する。"
17,マーケティング,CMO,CMOとして、全社的なマーケティング戦略をリードする,"ブランド戦略や顧客体験、自社のポジショニングを描き、マーケティングプロセス全体の構築や改善を担う。"
18,マーケティング,PMM（プロダクトマーケ）,PMMとして、製品の市場浸透とGo-to-Market戦略をリードする,"顧客インサイトに基づき、製品のポジショニングやメッセージを策定する。開発とビジネスの橋渡し役となり、作った製品が「売れる」仕組みを作る。"
19,マーケティング,クリエイティブディレクター,クリエイティブディレクターとして、経営課題をデザインで解決する,"ブランドの世界観やトーン＆マナーを統括し、質の高い表現を実装する。感性と論理を融合させ、ユーザーの心を動かすコミュニケーションを創る。"
20,マーケティング,データサイエンティスト,データサイエンティストとして、戦略的なデータ活用をリードする,"データドリブンな提案で、意思決定プロセスを支える。統計解析やデータ基盤のプロとして、マーケ・組織構築などあらゆる領域に提案を手掛ける。"
21,マーケティング,デジタルマーケティング責任者,デジタルマーケティング責任者として、事業成長をデータで牽引する,"Web広告、SEO、SNS等を統括し、リード獲得からLTV最大化までを設計する。テクノロジーと数値を駆使し、投資対効果の高いマーケティングを実現する。"
22,マーケティング,ブランドマーケター,ブランドマーケターとして、ブランド戦略を推進する,"ブランド・エクイティの向上を目的に、ブランド施策を実行する。マスメディアからWeb施策まで多岐にわたり手掛ける。"
23,マーケティング,広報・PRスペシャリスト,広報のプロとして、社会と企業の良好な関係性を構築する,"メディアリレーションやSNSを通じて情報を発信し、認知と好感度を高める。ブランドの代弁者としてファンを増やし、事業成長を側面から支援する。"
24,マーケティング,編集者・コンテンツ企画,編集者・コンテンツ企画として、言葉と文脈で価値を届ける,"Webメディア、出版、オウンドメディア等で、質の高いコンテンツを制作する。数字だけでなく「意味」や「ストーリー」を重視し、読者の心を動かす。"
25,ファイナンス・投資,CFO,CFOとして、財務戦略を通じて企業価値最大化をリードする,"資金調達、財務戦略立案、IPO準備やM&Aを主導し、経営の守りと攻めを財務面から支える経営パートナーとなる。"
26,ファイナンス・投資,資産形成・FIRE志向,早期の経済的自立を果たし、人生の選択肢を最大化する,"市場価値の高いスキルで高収入を得つつ、計画的な資産運用を行う。労働にとらわれない自由な生活基盤を築き、本当にやりたいことに時間を使う。"
27,コンサルティング,戦略コンサルタント,戦略コンサルタントとして、クライアント企業の経営戦略を描く,"中長期計画策定、新規事業検討、M&A戦略策定を行い、全社方針を考え抜く。経営陣を相手に未来予想を提示し、勝ち筋を示す。"
28,プロダクト・開発,CPO,事業会社のCPOとして、プロダクトの持続的な成長をリードする,"プロダクトの最高責任者として経営方針を打ち出し、全体の事業計画の立案から実行推進までを担う。"
29,プロダクト・開発,ITコンサルタント,ITコンサルタントとして、クライアントのIT課題解決をリードする,"業務分析からシステム導入支援までを担い、ITによる事業変革を実現する。経営層と現場双方の課題を抽出し、実行可能なソリューションを推進する。"
30,プロダクト・開発,プロジェクトマネージャー,プロジェクトマネージャーとして、プロジェクトを成功に導く,"要件定義、スケジュール、予算、品質を一貫して管理し、完遂させる。ステークホルダーとの調整を主導し、チームのパフォーマンスを最大化する。"
31,プロダクト・開発,プロダクトマネージャー,プロダクトマネージャーとして、プロダクト成長のための企画立案、実行を担う,"顧客課題の深堀りと市場分析を通じてプロダクトビジョンを策定し、開発・デザイン・営業等を巻き込み優れたUXを実現する。"
32,プロダクト・開発,社内SE・IT企画,社内ITの責任者として、組織の生産性とセキュリティを守る,"業務システムの企画・導入・運用を通じて、社員が働きやすい環境を整える。DX推進やセキュリティ対策も主導し、組織の基盤をテクノロジーで支える。"
33,エンジニア・IT,ITアーキテクト,システム全体の設計を担い、ビジネスとシステムを橋渡しするリーダーとなる,"事業戦略を理解し、最適なシステム構成を設計・推進する。技術選定から全体最適を実現する技術のスペシャリスト。"
34,エンジニア・IT,エンジニアリングマネージャー,エンジニアリングマネージャー（EM）として、開発組織の最大化を担う,"エンジニアの採用・育成・評価を行い、開発チームの生産性を向上させる。「人」と「組織」に向き合い、エンジニアが活躍できる環境を作る。"
35,エンジニア・IT,セキュリティスペシャリスト,セキュリティの専門家として、企業と情報をサイバーリスクから守る,"セキュリティポリシーの策定から、システムの脆弱性診断、インシデント対応までを担う。「攻め」の事業展開を「守り」の技術で支え、企業の信頼性を担保する。"
36,エンジニア・IT,フリーランスエンジニア,技術力を武器に、組織に属さず自由な働き方を実現する,"高度な開発スキルと実績で顧客から選ばれ続け、自身の市場価値を高める。案件選びから単価交渉まで自ら行い、プロフェッショナルとして独立独歩で活躍する。"
37,エンジニア・IT,フルスタックエンジニア,フルスタックエンジニアとして、開発を一貫する,"フロントエンド・バックエンド双方の設計・実装に対応し、インフラ構築まで一貫して担う。技術選定にも携わり、開発をリードする。"
38,エンジニア・IT,技術フェロー・顧問,技術フェローとして、管理職にならず技術力で組織に貢献する,"組織マネジメントは行わず、特定領域の圧倒的な技術知見で難題を解決する。エンジニアのロールモデルとなり、技術選定や品質向上において権威を発揮する。"
39,エンジニア・製造,CTO,CTOとして、企業の技術戦略と中長期の競争力を牽引する,"技術投資・組織体制・人材育成における意思決定を担う。技術を起点に持続可能な事業成長を実現する技術経営者を目指す。"
40,エンジニア・製造,R&D・研究開発,研究開発職として、次世代の技術シーズを創出する,"未知の技術や素材の研究を行い、将来の事業の柱となる種を生み出す。学術的な探究心と事業化の視点を持ち、イノベーションの源泉となる。"
41,エンジニア・製造,機械・ハードウェア設計,設計開発エンジニアとして、製品の構想から具現化までを担う,"市場ニーズに基づいた製品設計、試作、評価を行い、量産化を実現する。技術力とコスト意識を両立させ、競争力のあるモノづくりを推進する。"
42,エンジニア・製造,施工管理・プラント,施工管理として、大規模プロジェクトの現場を指揮する,"建設やプラントの現場において、工程・安全・品質・原価を管理する。多くの職人や関係者を束ね、地図や歴史に残るインフラを完成させる。"
43,エンジニア・製造,生産技術・プロセス,生産技術エンジニアとして、高品質・高効率なモノづくりを実現する,"製造ラインの設計や工法開発を行い、量産体制を構築・改善する。QCD（品質・コスト・納期）を追求し、製造現場の競争力を底上げする。"
44,WLB,ライフイベント重視,ライフイベントに合わせて自分らしい働き方を実現できる,"自身のライフプランを洗い出し、取りたいタイミングでWLBを取得できるように、市場から求められるだけのスキルや経験を計画的に身に着けていく。"
45,その他,エリアマネージャー,エリアマネージャーとして、複数拠点の収益と人材を統括する,"担当エリアの戦略立案、店長指導、数値管理を行い、エリア全体の成長を牽引する。現場と本部の結節点となり、経営方針を現場オペレーションに落とし込む。"
46,その他,経営管理・オペレーション,経営管理・オペレーションのプロとして、組織の屋台骨を支える,"経理・総務・法務などの領域で、正確かつ効率的な業務フローを構築・運用する。組織のガバナンスを維持し、事業部門が攻めに集中できる環境を整える。"
47,その他,地方創生・ソーシャル,社会課題の解決や地域活性化に、ビジネスの手法で取り組む,"営利の最大化だけでなく、社会的インパクトや地域への貢献を最優先する。手触り感のある現場で、人々の生活を豊かにする事業を推進する。"
48,その他,法務・知財スペシャリスト,法務・知財の専門家として、企業の法的リスクをコントロールする,"契約審査、紛争対応、知的財産戦略を通じて、事業の適法性と競争優位を守る。ビジネスを加速させるための法的スキームを提案し、経営を守りながら攻める。"
